[
  {
    "age": 0,
    "e0": 61.03,
    "geo": "AR",
    "retrieved_at": "2026-10-02",
    "source": "MOCK",
    "survival": 0.985,
    "year": 2000
  },
  {
    "age": 1,
    "e0": 61.03,
    "geo": "AR",
    "retrieved_at": "2026-10-02",
    "source": "MOCK",
    "survival": 0.998,
    "year": 2000
  },
  {
    "age": 2,
    "e0": 61.03,
    "geo": "AR",
    "retrieved_at": "2026-10-02",
    "source": "MOCK",
    "survival": 0.998,
    "year": 2000
  },
  {
    "age": 3,
    "e0": 61.03,
    "geo": "AR",
    "retrieved_at": "2026-10-02",
    "source": "MOCK",
    "survival": 0.998,
    "year": 2000
  },
  {
    "age": 4,
    "e0": 61.03,
    "geo": "AR",
    "retrieved_at": "2026-10-02",
    "source": "MOCK",
    "survival": 0.998,
    "year": 2000
  },
  {
    "age": 5,
    "e0": 61.03,
    "geo": "AR",
    "retrieved_at": "2026-10-02",
    "source": "MOCK",
    "survival": 0.998,
    "year": 2000
  },
  {
    "age": 6,
    "e0": 61.03,
    "geo": "AR",
    "retrieved_at": "2026-10-02",
    "source": "MOCK",
    "survival": 0.998,
    "year": 2000
  },
  {
    "age": 7,
    "e0": 61.03,
    "geo": "AR",
    "retrieved_at": "2026-10-02",
    "source": "MOCK",
    "survival": 0.998,
    "year": 2000
  },
  {
    "age": 8,
    "e0": 61.03,
    "geo": "AR",
    "retrieved_at": "2026-10-02",
    "source": "MOCK",
    "survival": 0.998,
    "year": 2000
  },
  {
    "age": 9,
    "e0": 61.03,
    "geo": "AR",
    "retrieved_at": "2026-10-02",
    "source": "MOCK",
    "survival": 0.998,
    "year": 2000
  },
  {
    "age": 10,
    "e0": 61.03,
    "geo": "AR",
    "retrieved_at": "2026-10-02",
    "source": "MOCK",
    "survival": 0.998,
    "year": 2000
  },
  {
    "age": 11,
    "e0": 61.03,
    "geo": "AR",
    "retrieved_at": "2026-10-02",
    "source": "MOCK",
    "survival": 0.998,
    "year": 2000
  },
  {
    "age": 12,
    "e0": 61.03,
    "geo": "AR",
    "retrieved_at": "2026-10-02",
    "source": "MOCK",
    "survival": 0.998,
    "year": 2000
  },
  {
    "age": 13,
    "e0": 61.03,
    "geo": "AR",
    "retrieved_at": "2026-10-02",
    "source": "MOCK",
    "survival": 0.998,
    "year": 2000
  },
  {
    "age": 14,
    "e0": 61.03,
    "geo": "AR",
    "retrieved_at": "2026-10-02",
    "source": "MOCK",
    "survival": 0.998,
    "year": 2000
  },
  {
    "age": 15,
    "e0": 61.03,
    "geo": "AR",
    "retrieved_at": "2026-10-02",
    "source": "MOCK",
    "survival": 0.998,
    "year": 2000
  },
  {
    "age": 16,
    "e0": 61.03,
    "geo": "AR",
    "retrieved_at": "2026-10-02",
    "source": "MOCK",
    "survival": 0.998,
    "year": 2000
  },
  {
    "age": 17,
    "e0": 61.03,
    "geo": "AR",
    "retrieved_at": "2026-10-02",
    "source": "MOCK",
    "survival": 0.998,
    "year": 2000
  },
  {
    "age": 18,
    "e0": 61.03,
    "geo": "AR",
    "retrieved_at": "2026-10-02",
    "source": "MOCK",
    "survival": 0.998,
    "year": 2000
  },
  {
    "age": 19,
    "e0": 61.03,
    "geo": "AR",
    "retrieved_at": "2026-10-02",
    "source": "MOCK",
    "survival": 0.998,
    "year": 2000
  },
  {
    "age": 20,
    "e0": 61.03,
    "geo": "AR",
    "retrieved_at": "2026-10-02",
    "source": "MOCK",
    "survival": 0.998,
    "year": 2000
  },
  {
    "age": 21,
    "e0": 61.03,
    "geo": "AR",
    "retrieved_at": "2026-10-02",
    "source": "MOCK",
    "survival": 0.998,
    "year": 2000
  },
  {
    "age": 22,
    "e0": 61.03,
    "geo": "AR",
    "retrieved_at": "2026-10-02",
    "source": "MOCK",
    "survival": 0.998,
    "year": 2000
  },
  {
    "age": 23,
    "e0": 61.03,
    "geo": "AR",
    "retrieved_at": "2026-10-02",
    "source": "MOCK",
    "survival": 0.998,
    "year": 2000
  },
  {
    "age": 24,
    "e0": 61.03,
    "geo": "AR",
    "retrieved_at": "2026-10-02",
    "source": "MOCK",
    "survival": 0.998,
    "year": 2000
  },
  {
    "age": 25,
    "e0": 61.03,
    "geo": "AR",
    "retrieved_at": "2026-10-02",
    "source": "MOCK",
    "survival": 0.998,
    "year": 2000
  },
  {
    "age": 26,
    "e0": 61.03,
    "geo": "AR",
    "retrieved_at": "2026-10-02",
    "source": "MOCK",
    "survival": 0.998,
    "year": 2000
  },
  {
    "age": 27,
    "e0": 61.03,
    "geo": "AR",
    "retrieved_at": "2026-10-02",
    "source": "MOCK",
    "survival": 0.998,
    "year": 2000
  },
  {
    "age": 28,
    "e0": 61.03,
    "geo": "AR",
    "retrieved_at": "2026-10-02",
    "source": "MOCK",
    "survival": 0.998,
    "year": 2000
  },
  {
    "age": 29,
    "e0": 61.03,
    "geo": "AR",
    "retrieved_at": "2026-10-02",
    "source": "MOCK",
    "survival": 0.998,
    "year": 2000
  },
  {
    "age": 30,
    "e0": 61.03,
    "geo": "AR",
    "retrieved_at": "2026-10-02",
    "source": "MOCK",
    "survival": 0.998,
    "year": 2000
  },
  {
    "age": 31,
    "e0": 61.03,
    "geo": "AR",
    "retrieved_at": "2026-10-02",
    "source": "MOCK",
    "survival": 0.998,
    "year": 2000
  },
  {
    "age": 32,
    "e0": 61.03,
    "geo": "AR",
    "retrieved_at": "2026-10-02",
    "source": "MOCK",
    "survival": 0.998,
    "year": 2000
  },
  {
    "age": 33,
    "e0": 61.03,
    "geo": "AR",
    "retrieved_at": "2026-10-02",
    "source": "MOCK",
    "survival": 0.998,
    "year": 2000
  },
  {
    "age": 34,
    "e0": 61.03,
    "geo": "AR",
    "retrieved_at": "2026-10-02",
    "source": "MOCK",
    "survival": 0.998,
    "year": 2000
  },
  {
    "age": 35,
    "e0": 61.03,
    "geo": "AR",
    "retrieved_at": "2026-10-02",
    "source": "MOCK",
    "survival": 0.998,
    "year": 2000
  },
  {
    "age": 36,
    "e0": 61.03,
    "geo": "AR",
    "retrieved_at": "2026-10-02",
    "source": "MOCK",
    "survival": 0.998,
    "year": 2000
  },
  {
    "age": 37,
    "e0": 61.03,
    "geo": "AR",
    "retrieved_at": "2026-10-02",
    "source": "MOCK",
    "survival": 0.998,
    "year": 2000
  },
  {
    "age": 38,
    "e0": 61.03,
    "geo": "AR",
    "retrieved_at": "2026-10-02",
    "source": "MOCK",
    "survival": 0.998,
    "year": 2000
  },
  {
    "age": 39,
    "e0": 61.03,
    "geo": "AR",
    "retrieved_at": "2026-10-02",
    "source": "MOCK",
    "survival": 0.998,
    "year": 2000
  },
  {
    "age": 40,
    "e0": 61.03,
    "geo": "AR",
    "retrieved_at": "2026-10-02",
    "source": "MOCK",
    "survival": 0.998,
    "year": 2000
  },
  {
    "age": 41,
    "e0": 61.03,
    "geo": "AR",
    "retrieved_at": "2026-10-02",
    "source": "MOCK",
    "survival": 0.996,
    "year": 2000
  },
  {
    "age": 42,
    "e0": 61.03,
    "geo": "AR",
    "retrieved_at": "2026-10-02",
    "source": "MOCK",
    "survival": 0.994,
    "year": 2000
  },
  {
    "age": 43,
    "e0": 61.03,
    "geo": "AR",
    "retrieved_at": "2026-10-02",
    "source": "MOCK",
    "survival": 0.992,
    "year": 2000
  },
  {
    "age": 44,
    "e0": 61.03,
    "geo": "AR",
    "retrieved_at": "2026-10-02",
    "source": "MOCK",
    "survival": 0.99,
    "year": 2000
  },
  {
    "age": 45,
    "e0": 61.03,
    "geo": "AR",
    "retrieved_at": "2026-10-02",
    "source": "MOCK",
    "survival": 0.988,
    "year": 2000
  },
  {
    "age": 46,
    "e0": 61.03,
    "geo": "AR",
    "retrieved_at": "2026-10-02",
    "source": "MOCK",
    "survival": 0.986,
    "year": 2000
  },
  {
    "age": 47,
    "e0": 61.03,
    "geo": "AR",
    "retrieved_at": "2026-10-02",
    "source": "MOCK",
    "survival": 0.984,
    "year": 2000
  },
  {
    "age": 48,
    "e0": 61.03,
    "geo": "AR",
    "retrieved_at": "2026-10-02",
    "source": "MOCK",
    "survival": 0.982,
    "year": 2000
  },
  {
    "age": 49,
    "e0": 61.03,
    "geo": "AR",
    "retrieved_at": "2026-10-02",
    "source": "MOCK",
    "survival": 0.98,
    "year": 2000
  },
  {
    "age": 50,
    "e0": 61.03,
    "geo": "AR",
    "retrieved_at": "2026-10-02",
    "source": "MOCK",
    "survival": 0.978,
    "year": 2000
  },
  {
    "age": 51,
    "e0": 61.03,
    "geo": "AR",
    "retrieved_at": "2026-10-02",
    "source": "MOCK",
    "survival": 0.976,
    "year": 2000
  },
  {
    "age": 52,
    "e0": 61.03,
    "geo": "AR",
    "retrieved_at": "2026-10-02",
    "source": "MOCK",
    "survival": 0.974,
    "year": 2000
  },
  {
    "age": 53,
    "e0": 61.03,
    "geo": "AR",
    "retrieved_at": "2026-10-02",
    "source": "MOCK",
    "survival": 0.972,
    "year": 2000
  },
  {
    "age": 54,
    "e0": 61.03,
    "geo": "AR",
    "retrieved_at": "2026-10-02",
    "source": "MOCK",
    "survival": 0.97,
    "year": 2000
  },
  {
    "age": 55,
    "e0": 61.03,
    "geo": "AR",
    "retrieved_at": "2026-10-02",
    "source": "MOCK",
    "survival": 0.968,
    "year": 2000
  },
  {
    "age": 56,
    "e0": 61.03,
    "geo": "AR",
    "retrieved_at": "2026-10-02",
    "source": "MOCK",
    "survival": 0.966,
    "year": 2000
  },
  {
    "age": 57,
    "e0": 61.03,
    "geo": "AR",
    "retrieved_at": "2026-10-02",
    "source": "MOCK",
    "survival": 0.964,
    "year": 2000
  },
  {
    "age": 58,
    "e0": 61.03,
    "geo": "AR",
    "retrieved_at": "2026-10-02",
    "source": "MOCK",
    "survival": 0.962,
    "year": 2000
  },
  {
    "age": 59,
    "e0": 61.03,
    "geo": "AR",
    "retrieved_at": "2026-10-02",
    "source": "MOCK",
    "survival": 0.96,
    "year": 2000
  },
  {
    "age": 60,
    "e0": 61.03,
    "geo": "AR",
    "retrieved_at": "2026-10-02",
    "source": "MOCK",
    "survival": 0.958,
    "year": 2000
  },
  {
    "age": 61,
    "e0": 61.03,
    "geo": "AR",
    "retrieved_at": "2026-10-02",
    "source": "MOCK",
    "survival": 0.956,
    "year": 2000
  },
  {
    "age": 62,
    "e0": 61.03,
    "geo": "AR",
    "retrieved_at": "2026-10-02",
    "source": "MOCK",
    "survival": 0.954,
    "year": 2000
  },
  {
    "age": 63,
    "e0": 61.03,
    "geo": "AR",
    "retrieved_at": "2026-10-02",
    "source": "MOCK",
    "survival": 0.952,
    "year": 2000
  },
  {
    "age": 64,
    "e0": 61.03,
    "geo": "AR",
    "retrieved_at": "2026-10-02",
    "source": "MOCK",
    "survival": 0.95,
    "year": 2000
  },